{
  "name": "agentops",
  "version": "2.41.1",
  "description": "The operational layer for coding agents. Bookkeeping, validation, and flows that compound knowledge between sessions.",
  "author": {
    "name": "Boden Fuller",
    "email": "fullerbt@users.noreply.github.com"
  },
  "homepage": "https://github.com/boshu2/agentops",
  "repository": "https://github.com/boshu2/agentops",
  "license": "Apache-2.0",
  "keywords": [
    "devops",
    "vibe-coding",
    "shift-left",
    "validation",
    "coding-agents",
    "knowledge-flywheel",
    "pre-mortem",
    "vibe-check",
    "workflow",
    "skills",
    "ao-cli"
  ]
}
